Fecha de Scraping,Título,Descripción
2024-06-23 17:39:49,"Casa en Arriendo, Variante Condina, Pereira",
2024-06-23 17:39:49,"Casa en Arriendo, Otro, Manizales",$9.000.000 | 210 m² | 3 | 3
2024-06-23 17:39:49,"Apartamento en Arriendo, LOS ROSALES, Bogotá D.C.",$9.000.000 | 210 m² | 3 | 3
2024-06-23 17:39:49,"Casa en Arriendo, Comuna El Jardin/Av  30 Agosto, Pereira",
2024-06-23 17:39:49,"Apartamento en Arriendo, Batara Condina, Pereira",$4.000.000 | 87 m² | 3 | 3
2024-06-23 17:39:49,"Apartaestudio en Arriendo, Pinares, Pereira",$4.000.000 | 87 m² | 3 | 3
2024-06-23 17:39:49,"Apartaestudio en Arriendo, Comuna Universidad/Pinares, Pereira",
2024-06-23 17:39:49,"Apartamento en Arriendo, Comuna Centro, Pereira",$15.000.000 | 400 m² | 4 | 5
2024-06-23 17:39:49,"Apartamento en Arriendo, Otro, Manizales",$15.000.000 | 400 m² | 4 | 5
2024-06-23 17:39:49,"Apartamento en Arriendo, Centro, Pereira",
2024-06-23 17:39:49,"Apartamento en Arriendo, La Francia, Manizales",$6.700.000 | 106 m² | 3 | 2
2024-06-23 17:39:49,"Apartamento en Arriendo, Baja Suiza, Manizales",$6.700.000 | 106 m² | 3 | 2
2024-06-23 17:39:49,"Apartamento en Arriendo, La Macarena, Dos Quebradas",
2024-06-23 17:39:49,"Apartamento en Arriendo, La Francia, Manizales",$9.000.000 | 125 m² | 2 | 3
2024-06-23 17:39:49,"Apartamento en Arriendo, El Japon, Dos Quebradas",$9.000.000 | 125 m² | 2 | 3
2024-06-23 17:39:49,"Apartamento en Arriendo, Comuna Boston/Olaya Herrera, Pereira",
2024-06-23 17:39:49,"Apartamento en Arriendo, Estrella, Manizales",88.5 | 3 | 3
2024-06-23 17:39:49,"Casa en Arriendo, Sopo, Sopo (Incluye Yerbabuena)",91 | 3 | 2
2024-06-23 17:39:49,"Apartamento en Arriendo, Otro, Manizales",180 | 3 | 4
2024-06-23 17:39:49,"Apartamento en Arriendo, Baja Suiza, Manizales",$12.000.000 | 350 m² | 3 | 3
2024-06-23 17:39:49,"Apartamento en Arriendo, Milan, Manizales",$12.000.000 | 350 m² | 3 | 3
2024-06-23 17:39:49,"Apartaestudio en Arriendo, Pinares, Pereira",
2024-06-23 17:39:49,"Apartaestudio en Arriendo, Pinares, Pereira",$14.000.000 | 300 m² | 3 | 5
2024-06-23 17:39:49,"Apartamento en Arriendo, Comuna Boston/Olaya Herrera, Pereira",$14.000.000 | 300 m² | 3 | 5
2024-06-23 17:39:49,"Apartaestudio en Arriendo, Pinares, Pereira",
2024-06-23 17:39:49,"Apartamento en Arriendo, Milan, Manizales",$6.850.000 | 96 m² | 3 | 2
2024-06-23 17:39:49,"Apartamento en Arriendo, Palermo, Manizales",$6.850.000 | 96 m² | 3 | 2
2024-06-23 17:39:49,"Apartaestudio en Arriendo, La Macarena, Dos Quebradas",
2024-06-23 17:39:49,"Apartamento en Arriendo, Villa Pilar Ii, Manizales",$2.700.000 | 74 m² | 2 | 3
2024-06-23 17:39:49,"Apartaestudio en Arriendo, Los Rosales, Manizales",$2.700.000 | 74 m² | 2 | 3
2024-06-23 17:39:49,"Apartamento en Arriendo, Palermo, Manizales",
2024-06-23 17:39:49,"Apartamento en Arriendo, San Joaquin, Manizales",$3.800.000 | 126 m² | 3 | 2
2024-06-23 17:39:49,"Apartamento en Arriendo, Otro, Manizales",$3.800.000 | 126 m² | 3 | 2
2024-06-23 17:39:49,"Apartamento en Arriendo, Centro, Manizales",
2024-06-23 17:39:49,"Apartaestudio en Arriendo, Palermo, Manizales",$4.200.000 | 70 m² | 2 | 3
2024-06-23 17:39:49,"Apartamento en Arriendo, Otro, Manizales",$4.200.000 | 70 m² | 2 | 3
2024-06-23 17:39:49,"Apartamento en Arriendo, Villamaria, Villamaria",
2024-06-23 17:39:49,"Apartamento en Arriendo, La Francia, Manizales",$3.150.000 | 126 m² | 3 | 3
2024-06-23 17:39:49,"Apartaestudio en Arriendo, Los Rosales, Manizales",$3.150.000 | 126 m² | 3 | 3
2024-06-23 17:39:49,"Apartamento en Arriendo, La Francia, Manizales",
2024-06-23 17:39:49,"Apartamento en Arriendo, La Francia, Manizales",$17.000.000 | 416 m² | 3 | 3
2024-06-23 17:39:49,"Apartaestudio en Arriendo, La Francia, Manizales",$17.000.000 | 416 m² | 3 | 3
2024-06-23 17:39:49,"Apartamento en Arriendo, Campo Hermoso, Manizales",
2024-06-23 17:39:49,"Apartamento en Arriendo, Otro, Manizales",$9.060.000 | 393 m² | 4 | 5
2024-06-23 17:39:49,"Apartamento en Arriendo, La Sultana, Manizales",$9.060.000 | 393 m² | 4 | 5
2024-06-23 17:39:49,"Apartamento en Arriendo, La Rambla, Manizales",
2024-06-23 17:39:49,"Apartamento en Arriendo, Otro, Manizales",$4.350.000 | 104 m² | 3 | 3
2024-06-23 17:39:49,"Apartamento en Arriendo, Baja Suiza, Manizales",$4.350.000 | 104 m² | 3 | 3
2024-06-23 17:39:49,"Apartamento en Arriendo, Otro, Manizales",
2024-06-23 17:39:49,"Apartamento en Arriendo, La Francia, Manizales",$5.500.000 | 95 m² | 2 | 2
2024-06-23 17:39:49,"Apartamento en Arriendo, El Bosque, Manizales",$5.500.000 | 95 m² | 2 | 2
2024-06-23 17:39:49,"Casa en Arriendo, Chia, Chía",
2024-06-23 17:39:49,"Casa en Arriendo, Chia, Chía",$12.000.000 | 215 m² | 3 | 3
2024-06-23 17:39:49,"Casa en Arriendo, Guaymaral, Bogotá D.C.",$12.000.000 | 215 m² | 3 | 3
2024-06-23 17:39:49,"Casa en Arriendo, Chia, Chía",
2024-06-23 17:39:49,"Casa en Arriendo, Chia, Chía",$7.800.000 | 117 m² | 2 | 3
2024-06-23 17:39:49,"Casa en Arriendo, Chia, Chía",$7.800.000 | 117 m² | 2 | 3
2024-06-23 17:39:49,"Casa en Arriendo, Chia, Chía",
2024-06-23 17:39:49,"Casa en Arriendo, San Jose De Bavaria, Bogotá D.C.",$2.400.000 | 70 m² | 2 | 2
2024-06-23 17:39:49,"Casa en Arriendo, Chia, Chía",$2.400.000 | 70 m² | 2 | 2
2024-06-23 17:39:49,"Casa en Arriendo, Chia, Chía",
2024-06-23 17:39:49,"Casa en Arriendo, Sopo, Sopo (Incluye Yerbabuena)",$2.750.000 | 80 m² | 3 | 2
2024-06-23 17:39:49,"Casa en Arriendo, Hacienda San Sebastian, Bogotá D.C.",$2.750.000 | 80 m² | 3 | 2
2024-06-23 17:39:49,"Apartamento en Arriendo, Altos Del Poblado Cola Del Zorro, Med…",
2024-06-23 17:39:49,"Apartamento en Arriendo, La Asomadera, Medellín",$6.500.000 | 89 m² | 2 | 3
2024-06-23 17:39:49,"Apartamento en Arriendo, La Visitacion Los Gonzalez, Medellín",$6.500.000 | 89 m² | 2 | 3
2024-06-23 17:39:49,"Casa en Arriendo, Chia, Chía",
2024-06-23 17:39:49,"Apartamento en Arriendo, Los Rosales, Bogotá D.C.",$4.000.000 | 88 m² | 3 | 2
2024-06-23 17:39:49,"Apartamento en Arriendo, Chico Reservado, Bogotá D.C.",$4.000.000 | 88 m² | 3 | 2
2024-06-23 17:39:49,"Finca en Arriendo, Mundo Nuevo, Pereira",
2024-06-23 17:39:49,"Casa en Arriendo, Colina Campestre, Bogotá D.C.",$2.400.000 | 70 m² | 3 | 2
2024-06-23 17:39:49,"Apartamento en Arriendo, Aves Maria, Sabaneta",$2.400.000 | 70 m² | 3 | 2
2024-06-23 17:39:49,"Apartamento en Arriendo, Ces, Sabaneta",
2024-06-23 17:39:49,"Apartamento en Arriendo, Aves Maria, Sabaneta",$2.200.000 | 95 m² | 2 | 2
2024-06-23 17:39:49,"Apartamento en Arriendo, Alto Prado, Barranquilla",$2.200.000 | 95 m² | 2 | 2
2024-06-23 17:39:49,"Apartamento en Arriendo, Vereda San Jose, Sabaneta",
2024-06-23 17:39:49,"Apartamento en Arriendo, Bosque Medina Usaquen, Bogotá D.C.",$10.500.000 | 220 m² | 3 | 4
2024-06-23 17:39:49,"Apartamento en Arriendo, La Cabrera, Bogotá D.C.",$10.500.000 | 220 m² | 3 | 4
2024-06-23 17:39:49,"Casa en Arriendo, Ciudad Jardin, Barranquilla",
2024-06-23 17:39:49,"Apartamento en Arriendo, Montearroyo, Bogotá D.C.",$4.500.000 | 82 m² | 2 | 3
2024-06-23 17:39:49,"Casa en Arriendo, Rincon Del Chico, Bogotá D.C.",$4.500.000 | 82 m² | 2 | 3
2024-06-23 17:39:49,"Casa en Arriendo, Bosque De Pinos Usaquen, Bogotá D.C.",
2024-06-23 17:39:49,"Apartamento en Arriendo, Chapinero Alto, Bogotá D.C.",$9.600.000 | 203 m² | 2 | 3
2024-06-23 17:39:49,"Apartamento en Arriendo, Santa Barbara Alta Usaquen, Bogotá …",$9.600.000 | 203 m² | 2 | 3
2024-06-23 17:39:49,"Apartamento en Arriendo, Loma Las Brujas, Envigado",
2024-06-23 17:39:49,"Apartamento en Arriendo, San Joaquin, Sabaneta",$2.200.000 | 120 m² | 4 | 3
2024-06-23 17:39:49,"Apartamento en Arriendo, Santa Barbara Alta Usaquen, Bogotá …",$2.200.000 | 120 m² | 4 | 3
2024-06-23 17:39:49,"Apartamento en Arriendo, Santa Barbara Alta Usaquen, Bogotá …",
2024-06-23 17:39:49,"Apartamento en Arriendo, Los Cedros Oriental, Bogotá D.C.",$11.500.000 | 213.45 m² | 3 | 4
2024-06-23 17:39:49,"Apartamento en Arriendo, Bella Suiza Usaquen, Bogotá D.C.",$11.500.000 | 213.45 m² | 3 | 4
2024-06-23 17:39:49,"Apartamento en Arriendo, Santa Barbara Alta Usaquen, Bogotá …",
2024-06-23 17:39:49,"Apartamento en Arriendo, El Refugio I, Bogotá D.C.",$6.500.000 | 160 m² | 4 | 4
2024-06-23 17:39:49,"Apartamento en Arriendo, Valle De Luna, Chía",$6.500.000 | 160 m² | 4 | 4
2024-06-23 17:39:49,"Apartamento en Arriendo, Aves Maria, Sabaneta",
2024-06-23 17:39:49,"Apartamento en Arriendo, Batan, Bogotá D.C.",$3.500.000 | 60 m² | 1 | 2
2024-06-23 17:39:49,"Apartamento en Arriendo, Villa Carolina, Barranquilla",$3.500.000 | 60 m² | 1 | 2
2024-06-23 17:39:49,"Casa en Arriendo, Villa Campestre, Puerto Colombia",
2024-06-23 17:39:49,"Apartamento en Arriendo, Chico Norte, Bogotá D.C.",$11.000.000 | 168 m² | 3 | 4
2024-06-23 17:39:49,"Apartamento en Arriendo, Envigado El Salado, Envigado",$11.000.000 | 168 m² | 3 | 4
2024-06-23 17:39:49,"Apartamento en Arriendo, Los Rosales, Bogotá D.C.",
2024-06-23 17:39:49,"Apartamento en Arriendo, Miramar, Barranquilla",$5.100.000 | 170 m² | 3 | 4
2024-06-23 17:39:49,"Casa en Arriendo, La Calera, La Calera",$5.100.000 | 170 m² | 3 | 4
2024-06-23 17:39:49,"Apartamento en Arriendo, Santa Ana Oriental Usaquen, Bogotá …",
2024-06-23 17:39:49,"Apartamento en Arriendo, Zona Norte, Cartagena de Indias",$9.500.000 | 170 m² | 3 | 3
2024-06-23 17:39:49,"Apartamento en Arriendo, Multicentro, Bogotá D.C.",$9.500.000 | 170 m² | 3 | 3
2024-06-23 17:39:49,"Apartamento en Arriendo, Portal De Genoves, Puerto Colombia",
2024-06-23 17:39:49,"Apartamento en Arriendo, La Carolina Usaquen, Bogotá D.C.",$8.000.000 | 96 m² | 3 | 2
2024-06-23 17:39:49,"Apartamento en Arriendo, El Calvario, Cali",$8.000.000 | 96 m² | 3 | 2
2024-06-23 17:39:49,"Apartamento en Arriendo, El Recreo, Floridablanca",
2024-06-23 17:39:49,"Apartamento en Arriendo, Los Rosales, Bogotá D.C.",$3.800.000 | 65 m² | 1 | 2
2024-06-23 17:39:49,"Apartamento en Arriendo, Ciudad Jardin, Cali",$3.800.000 | 65 m² | 1 | 2
2024-06-23 17:39:49,"Apartamento en Arriendo, La Cabrera, Bogotá D.C.",
2024-06-23 17:39:49,"Oficina en Arriendo, Centro, Armenia",$8.300.000 | 209 m² | 3 | 4
2024-06-23 17:39:49,"Apartamento en Arriendo, Santa Barbara Alta, Bogotá D.C.",$8.300.000 | 209 m² | 3 | 4
2024-06-23 17:39:49,"Oficina en Arriendo, Centro, Pereira",
2024-06-23 17:39:49,"Oficina en Arriendo, Otro, Pereira",$5.600.000 | 160 m² | 3 | 3
2024-06-23 17:39:49,"Apartamento en Arriendo, Chapinero Alto, Bogotá D.C.",$5.600.000 | 160 m² | 3 | 3
2024-06-23 17:39:49,"Casa en Arriendo, Cerritos, Pereira",
2024-06-23 17:39:49,"Apartamento en Arriendo, El Virrey, Bogotá D.C.",$20.000.000 | 317 m² | 3 | 4
2024-06-23 17:39:49,"Oficina en Arriendo, Comuna Centro, Pereira",$20.000.000 | 317 m² | 3 | 4
2024-06-23 17:39:49,"Casa en Arriendo, La Sebastiana, Envigado",
2024-06-23 17:39:49,"Oficina en Arriendo, Comuna Olimpica/La Villa, Pereira",$7.500.000 | 210 m² | 3 | 4
2024-06-23 17:39:49,"Oficina en Arriendo, Antiguo Country, Bogotá D.C.",$7.500.000 | 210 m² | 3 | 4
2024-06-23 17:39:49,"Apartamento en Arriendo, Chico Virrey, Bogotá D.C.",
2024-06-23 17:39:49,"Apartamento en Arriendo, Crespo, Cartagena de Indias",$8.500.000 | 197 m² | 3 | 5
2024-06-23 17:39:49,"Apartamento en Arriendo, La Pola, Ibagué",$8.500.000 | 197 m² | 3 | 5
2024-06-23 17:39:49,"Apartamento en Arriendo, El Nogal, Bogotá D.C.",
2024-06-23 17:39:49,"Oficina en Arriendo, Otro, Manizales",$14.000.000 | 500 m² | 3 | 5
2024-06-23 17:39:49,"Oficina en Arriendo, Vereda El Tablazo, Manizales",$14.000.000 | 500 m² | 3 | 5
2024-06-23 17:39:49,"Apartamento en Arriendo, Colombia, Barranquilla",
2024-06-23 17:39:49,"Oficina en Arriendo, El Chico, Bogotá D.C.",$2.100.000 | 60 m² | 2 | 2
2024-06-23 17:39:49,"Apartamento en Arriendo, Granadillo, Barranquilla",$2.100.000 | 60 m² | 2 | 2
2024-06-23 17:39:49,"Casa en Arriendo, Vereda San Jose, Sabaneta",
2024-06-23 17:39:49,"Apartamento en Arriendo, Chico Navarra, Bogotá D.C.",$2.150.000 | 60 m² | 2 | 2
2024-06-23 17:39:49,"Apartamento en Arriendo, Los Parra, Medellín",$2.150.000 | 60 m² | 2 | 2
2024-06-23 17:39:49,"Casa en Arriendo, Tamarido Contemporaneo, Villa Rosario",
2024-06-23 17:39:49,"Casa en Arriendo, La Calera, La Calera",$8.200.000 | 440 m² | 5 | 4
2024-06-23 17:39:49,"Apartamento en Arriendo, Manga, Cartagena de Indias",$8.200.000 | 440 m² | 5 | 4
2024-06-23 17:39:49,"Apartamento en Arriendo, Aguamarina Beach Resort, Juan De A…",
2024-06-23 17:39:49,"Casa en Arriendo, La Calera, La Calera",$6.500.000 | 150 m² | 2 | 4
2024-06-23 17:39:49,"Apartamento en Arriendo, Altos De Riomar, Barranquilla",$6.500.000 | 150 m² | 2 | 4
2024-06-23 17:39:49,"Apartamento en Arriendo, Guayabal, Medellín",
2024-06-23 17:39:49,"Apartamento en Arriendo, Zona Norte, Cartagena de Indias",$8.500.000 | 122 m² | 2 | 3
2024-06-23 17:39:49,"Apartamento en Arriendo, Guayabal, Medellín",$8.500.000 | 122 m² | 2 | 3
2024-06-23 17:39:49,"Apartamento en Arriendo, Valle Del Lili, Cali",
2024-06-23 17:39:49,"Apartamento en Arriendo, Barrio 20 De Julio, Chía",$10.000.000 | 240 m² | 3 | 4
2024-06-23 17:39:49,"Apartamento en Arriendo, Guayabal, Medellín",$10.000.000 | 240 m² | 3 | 4
2024-06-23 17:39:49,"Local Comercial en Arriendo, Av Sur, Pereira",
2024-06-23 17:39:49,"Local Comercial en Arriendo, Via Armenia, Pereira",$9.500.000 | 256 m² | 3 | 3
2024-06-23 17:39:49,"Apartamento en Arriendo, Guayabal, Medellín",$9.500.000 | 256 m² | 3 | 3
2024-06-23 17:39:49,"Apartamento en Arriendo, Guayabal, Medellín",
2024-06-23 17:39:49,"Local Comercial en Arriendo, Comuna 7/El Progreso, Dos Quebr…",$9.800.000 | 270 m² | 4 | 5
2024-06-23 17:39:49,"Local Comercial en Arriendo, Centro, Santa Rosa De Cabal",$9.800.000 | 270 m² | 4 | 5
2024-06-23 17:39:49,"Local Comercial en Arriendo, San Jorge, Manizales",
2024-06-23 17:39:49,"Local Comercial en Arriendo, Palogrande, Manizales",$12.000.000 | 313 m² | 4 | 5
2024-06-23 17:39:49,"Apartamento en Arriendo, Campin, Bogotá D.C.",$12.000.000 | 313 m² | 4 | 5
2024-06-23 17:39:49,"Apartamento en Arriendo, Fontana 1, Madrid",
2024-06-23 17:39:49,"Casa en Arriendo, Vereda Canelon, Cajicá",$20.200.000 | 315 m² | 3 | 4
2024-06-23 17:39:49,"Casa en Arriendo, Hacienda El Castillo, Jamundi",$20.200.000 | 315 m² | 3 | 4
2024-06-23 17:39:49,"Apartamento en Arriendo, Alhambra, Bogotá D.C.",
2024-06-23 17:39:49,"Apartamento en Arriendo, Ciudad Mallorquin, Puerto Colombia",$3.600.000 | 120 m² | 2 | 2
2024-06-23 17:39:49,"Apartamento en Arriendo, Capri, Cali",$3.600.000 | 120 m² | 2 | 2
2024-06-23 17:39:49,"Oficina en Arriendo, EL SALITRE, Bogotá D.C.",
2024-06-23 17:39:49,"Casa en Arriendo, Conjunto Residencial Manantial De Las Merce…",$14.000.000 | 400 m² | 3 | 5
2024-06-23 17:39:49,"Apartamento en Arriendo, Guadalquivir, Bogotá D.C.",$14.000.000 | 400 m² | 3 | 5
2024-06-23 17:39:49,"Local Comercial en Arriendo, Comuna Cuba/Cuba, Pereira",
2024-06-23 17:39:49,"Local Comercial en Arriendo, Palermo, Manizales",$8.000.000 | 192 m² | 3 | 5
2024-06-23 17:39:49,"Local Comercial en Arriendo, Otro, Manizales",$8.000.000 | 192 m² | 3 | 5
2024-06-23 17:39:49,"Local Comercial en Arriendo, San Antonio, Manizales",
2024-06-23 17:39:49,"Apartamento en Arriendo, Retiro, Retiro",110 | 2 | 2
2024-06-23 17:39:49,"Oficina en Arriendo, CHICO, Bogotá D.C.",125 | 5 | 3
2024-06-23 17:39:49,"Apartamento en Arriendo, Porvenir, Rionegro",1153.24
2024-06-23 17:39:49,"Local Comercial en Arriendo, Centro, Manizales",$6.800.000 | 230 m² | 3 | 4
2024-06-23 17:39:49,"Oficina en Arriendo, SALITRE, Bogotá D.C.",$6.800.000 | 230 m² | 3 | 4
2024-06-23 17:39:49,"Oficina en Arriendo, SALITRE, Bogotá D.C.",
2024-06-23 17:39:49,"Oficina en Arriendo, Prado Veraniego  Spring Pinzon, Bogotá D.C.",$6.500.000 | 173 m² | 3 | 3
2024-06-23 17:39:49,"Oficina en Arriendo, CHICO, Bogotá D.C.",$6.500.000 | 173 m² | 3 | 3
2024-06-23 17:39:49,"Oficina en Arriendo, SALITRE MODELIA, Bogotá D.C.",
2024-06-23 17:39:49,"Oficina en Arriendo, Chico, Bogotá D.C.",$9.000.000 | 210 m² | 3 | 4
2024-06-23 17:39:49,"Oficina en Arriendo, SANTA BARABARA, Bogotá D.C.",$9.000.000 | 210 m² | 3 | 4
2024-06-23 17:39:49,"Local Comercial en Arriendo, Centro, Manizales",
2024-06-23 17:39:49,"Oficina en Arriendo, EL POBLADO, Medellín",$15.000.000 | 300 m² | 3 | 5
2024-06-23 17:39:49,"Oficina en Arriendo, EL POBLADO, Medellín",$15.000.000 | 300 m² | 3 | 5
2024-06-23 17:39:49,"Oficina en Arriendo, San Diego, Bogotá D.C.",
2024-06-23 17:39:49,"Apartamento en Arriendo, San Victorino, Bogotá D.C.",$6.500.000 | 180 m² | 3 | 3
2024-06-23 17:39:49,"Oficina en Arriendo, GUAYABAL, Medellín",$6.500.000 | 180 m² | 3 | 3
2024-06-23 17:39:49,"Oficina en Arriendo, SAN DIEGO III, Bogotá D.C.",
2024-06-23 17:39:49,"Oficina en Arriendo, SANTA BARBARA OCCIDENTAL, Bogotá D.C.",$7.000.000 | 220 m² | 3 | 3
2024-06-23 17:39:49,"Oficina en Arriendo, CIUDAD SALITRE, Bogotá D.C.",$7.000.000 | 220 m² | 3 | 3
2024-06-23 17:39:49,"Apartamento en Arriendo, Alameda Del Rio, Barranquilla",
2024-06-23 17:39:49,"Oficina en Arriendo, CHICO, Bogotá D.C.",$2.025.000 | 66 m² | 2 | 2
2024-06-23 17:39:49,"Oficina en Arriendo, CENTRO DE NEGOCIOS BELENUS, Chía",$2.025.000 | 66 m² | 2 | 2
2024-06-23 17:39:49,"Apartamento en Arriendo, Loma Del Escobero, Envigado",
2024-06-23 17:39:49,"Apartamento en Arriendo, Provenza, Bogotá D.C.",$6.000.001 | 83 m² | 2 | 3
2024-06-23 17:39:49,"Oficina en Arriendo, barranquilla, Barranquilla",$6.000.001 | 83 m² | 2 | 3
2024-06-23 17:39:49,"Oficina en Arriendo, chapinero, Bogotá D.C.",
2024-06-23 17:39:49,"Oficina en Arriendo, CHICO, Bogotá D.C.",$5.100.000 | 108 m² | 2 | 3
2024-06-23 17:39:49,"Oficina en Arriendo, chico, Bogotá D.C.",$5.100.000 | 108 m² | 2 | 3
2024-06-23 17:39:49,"Casa en Arriendo, El Chocho, Envigado",
2024-06-23 17:39:49,"Oficina en Arriendo, CIUDAD SALITRE, Bogotá D.C.",$1.500.000 | 59 m² | 3 | 2
2024-06-23 17:39:49,"Casa en Arriendo, Rionegro, Rionegro",$1.500.000 | 59 m² | 3 | 2
2024-06-23 17:39:49,"Oficina en Arriendo, NORTH POINT, Bogotá D.C.",
2024-06-23 17:39:49,"Oficina en Arriendo, LA CASTELLANA   MASTER CENTER, Bogotá…",$5.500.000 | 140 m² | 3 | 2
2024-06-23 17:39:49,"Apartamento en Arriendo, Santa Ana, Rionegro",$5.500.000 | 140 m² | 3 | 2
2024-06-23 17:39:49,"Local Comercial en Arriendo, Las Americas, Manizales",
2024-06-23 17:39:49,"Local Comercial en Arriendo, Fundadores, Manizales",$16.000.000 | 1752 m² | 5 | 4
2024-06-23 17:39:49,"Local Comercial en Arriendo, Circunvalar, Pereira",$16.000.000 | 1752 m² | 5 | 4
2024-06-23 17:39:49,"Oficina en Arriendo, PASADENA, Bogotá D.C.",
2024-06-23 17:39:49,"Local Comercial en Arriendo, Otro, Villamaria",$11.500.000 | 202 m² | 3 | 4
2024-06-23 17:39:49,"Oficina en Arriendo, SALITRE MODELIA, Bogotá D.C.",$11.500.000 | 202 m² | 3 | 4
2024-06-23 17:39:49,"Oficina en Arriendo, SALITRE MODELIA, Bogotá D.C.",
2024-06-23 17:39:49,"Local Comercial en Arriendo, Comuna Boston/Olaya Herrera, Pe…",$15.300.000 | 250 m² | 3 | 4
2024-06-23 17:39:49,"Local Comercial en Arriendo, Otro, Manizales",$15.300.000 | 250 m² | 3 | 4
2024-06-23 17:39:49,"Oficina en Arriendo, SANTA BARBARA AUTOPISTA, Bogotá D.C.",
2024-06-23 17:39:49,"Oficina en Arriendo, LA PORCINCULA, Bogotá D.C.",$5.000.000 | 119 m² | 2 | 3
2024-06-23 17:39:49,"Oficina en Arriendo, NOGAL ROSALES, Bogotá D.C.",$5.000.000 | 119 m² | 2 | 3
2024-06-23 17:39:49,"Oficina en Arriendo, PASADENA, Bogotá D.C.",
2024-06-23 17:39:49,"Oficina en Arriendo, EL POBLADO, Medellín",$6.800.000 | 123 m² | 2 | 3
2024-06-23 17:39:49,"Oficina en Arriendo, CHAPINERO CENTRAL, Bogotá D.C.",$6.800.000 | 123 m² | 2 | 3
2024-06-23 17:39:49,"Oficina en Arriendo, LAGO, Bogotá D.C.",
2024-06-23 17:39:49,"Oficina en Arriendo, CHICO, Bogotá D.C.",$8.500.000 | 225 m² | 3 | 4
2024-06-23 17:39:49,"Casa en Arriendo, Lorena, Medellín",$8.500.000 | 225 m² | 3 | 4
2024-06-23 17:39:49,"Oficina en Arriendo, CENTRO, Bogotá D.C.",
2024-06-23 17:39:49,"Oficina en Arriendo, CHICO LOS ROSALES, Bogotá D.C.",$640.000.000 | 86 m² | 3 | 2
2024-06-23 17:39:49,"Oficina en Arriendo, North Point, Bogotá D.C.",$640.000.000 | 86 m² | 3 | 2
2024-06-23 17:39:49,"Oficina en Arriendo, LA SOLEDAD, Bogotá D.C.",
2024-06-23 17:39:49,"Oficina en Arriendo, LA CASTELLANA, Bogotá D.C.",$22.000.000 | 261 m² | 3 | 5
2024-06-23 17:39:49,"Oficina en Arriendo, CABECERA DEL LLANO, Bucaramanga",$22.000.000 | 261 m² | 3 | 5
2024-06-23 17:39:49,"Oficina en Arriendo, EL POBLADO, Medellín",
2024-06-23 17:39:49,"Oficina en Arriendo, Cota (Incluye Siberia)",$3.420.000 | 44 m² | 1 | 2
2024-06-23 17:39:49,"Apartamento en Arriendo, La Doctora, Sabaneta",$3.420.000 | 44 m² | 1 | 2
2024-06-23 17:39:49,"Apartamento en Arriendo, Torices, Cartagena de Indias",
2024-06-23 17:39:49,"Oficina en Arriendo, BOSQUE DE PINOS, Bogotá D.C.",$4.100.000 | 85 m² | 3 | 2
2024-06-23 17:39:49,"Oficina en Arriendo, PONTEVEDRA, Bogotá D.C.",$4.100.000 | 85 m² | 3 | 2
2024-06-23 17:39:49,"Oficina en Arriendo, ZONA G, Bogotá D.C.",
2024-06-23 17:39:49,"Oficina en Arriendo, CHICO, Bogotá D.C.",$5.000.000 | 155 m² | 4 | 3
2024-06-23 17:39:49,"Oficina en Arriendo, PASADENA, Bogotá D.C.",$5.000.000 | 155 m² | 4 | 3
2024-06-23 17:39:49,"Local Comercial en Arriendo, Otro, Manizales",
2024-06-23 17:39:49,"Local Comercial en Arriendo, Enea, Manizales",$4.200.000 | 71 m² | 2 | 2
2024-06-23 17:39:49,"Local Comercial en Arriendo, Enea, Manizales",$4.200.000 | 71 m² | 2 | 2
2024-06-23 17:39:49,"Local Comercial en Arriendo, Comuna 5/La Pradera, Dos Quebra…",
2024-06-23 17:39:49,"Oficina en Arriendo, CHICO, Bogotá D.C.",$3.500.000 | 50 m² | 1 | 1
2024-06-23 17:39:49,"Oficina en Arriendo, CENTRO, Bogotá D.C.",$3.500.000 | 50 m² | 1 | 1
2024-06-23 17:39:49,"Oficina en Arriendo, CHICO, Bogotá D.C.",
2024-06-23 17:39:49,"Local Comercial en Arriendo, El Tabor, Barranquilla",$720.000 | 62 m² | 2 | 2
2024-06-23 17:39:49,"Casa en Arriendo, Rionegro, Rionegro",$720.000 | 62 m² | 2 | 2
2024-06-23 17:39:49,"Oficina en Arriendo, CENTRO INTERNACIONAL, Bogotá D.C.",
2024-06-23 17:39:49,"Oficina en Arriendo, CHICO RESERVADO, Bogotá D.C.",$7.500.000 | 110 m² | 2 | 2
2024-06-23 17:39:49,"Oficina en Arriendo, CHICO, Bogotá D.C.",$7.500.000 | 110 m² | 2 | 2
2024-06-23 17:39:49,"Oficina en Arriendo, San Diego, Bogotá D.C.",
2024-06-23 17:39:49,"Oficina en Arriendo, VERSALLES, Cali",$17.200.000 | 200 m² | 3 | 4
2024-06-23 17:39:49,"Oficina en Arriendo, SAN DIEGO III, Bogotá D.C.",$17.200.000 | 200 m² | 3 | 4
2024-06-23 17:39:49,"Oficina en Arriendo, USAQUEN, Bogotá D.C.",
2024-06-23 17:39:49,"Oficina en Arriendo, SAN DIEGO LA MACARENA, Bogotá D.C.",$4.400.000 | 110 m² | 2 | 2
2024-06-23 17:39:49,"Oficina en Arriendo, EL TOBERIN, Bogotá D.C.",$4.400.000 | 110 m² | 2 | 2
2024-06-23 17:39:49,"Casa en Arriendo, Cacique Sopo, Sopo (Incluye Yerbabuena)",
2024-06-23 17:39:49,"Oficina en Arriendo, San diego, Bogotá D.C.",$4.700.000 | 150 m² | 3 | 3
2024-06-23 17:39:49,"Oficina en Arriendo, ESTORIL, Bogotá D.C.",$4.700.000 | 150 m² | 3 | 3
2024-06-23 17:39:49,"Oficina en Arriendo, CHICO NORTE, Bogotá D.C.",
2024-06-23 17:39:49,"Oficina en Arriendo, BELEN SAN BERNARDO, Medellín",$7.400.000 | 105 m² | 2 | 3
2024-06-23 17:39:49,"Apartaestudio en Arriendo, Ciudad Del Rio, Medellín",$7.400.000 | 105 m² | 2 | 3
2024-06-23 17:39:49,"Casa en Arriendo, Prado Centro, Medellín",
2024-06-23 17:39:49,"Apartamento en Arriendo, Niza, Bogotá D.C.",$3.500.000 | 86 m² | 3 | 2
2024-06-23 17:39:49,"Casa en Arriendo, Santa Ana Oriental, Bogotá D.C.",$3.500.000 | 86 m² | 3 | 2
2024-06-23 17:39:49,"Apartamento en Arriendo, Cedritos, Bogotá D.C.",
2024-06-23 17:39:49,"Apartamento en Arriendo, Cuarto De Legua Guadalupe, Cali",$5.000.000 | 100 m² | 3 | 2
2024-06-23 17:39:49,"Apartamento en Arriendo, Bosque De Pinos Usaquen, Bogotá D.C.",$5.000.000 | 100 m² | 3 | 2
2024-06-23 17:39:49,"Casa en Arriendo, Los Gonzalez, Medellín",
2024-06-23 17:39:49,"Casa en Arriendo, El Chocho, Envigado",$19.600.000 | 227 m² | 4 | 5
2024-06-23 17:39:49,"Apartamento en Arriendo, La Sebastiana, Envigado",$19.600.000 | 227 m² | 4 | 5
2024-06-23 17:39:49,"Casa en Arriendo, Santa Barbara, Bogotá D.C.",
2024-06-23 17:39:49,"Local Comercial en Arriendo, El Tabor, Barranquilla",$4.000.000 | 130 m² | 3 | 2
2024-06-23 17:39:49,"Casa en Arriendo, Calasanz, Medellín",$4.000.000 | 130 m² | 3 | 2
2024-06-23 17:39:49,"Apartamento en Arriendo, Laureles, Medellín",
2024-06-23 17:39:49,"Apartamento en Arriendo, Porvenir, Rionegro",$2.050.000 | 60 m² | 3 | 2
2024-06-23 17:39:49,"Apartamento en Arriendo, Loma Del Escobero, Envigado",$2.050.000 | 60 m² | 3 | 2
2024-06-23 17:39:49,"Apartamento en Arriendo, Pontevedra, Bogotá D.C.",
2024-06-23 17:39:49,"Local Comercial en Arriendo, El Tabor, Barranquilla",$1.800.000 | 45 m² | 1 | 1
2024-06-23 17:39:49,"Casa en Arriendo, La Floresta, Bogotá D.C.",$1.800.000 | 45 m² | 1 | 1
2024-06-23 17:39:49,"Apartamento en Arriendo, Poblado, Medellín",
2024-06-23 17:39:49,"Apartamento en Arriendo, Alto De La Flores, Sabaneta",$40.000.000 | 367 m² | 3 | 4
2024-06-23 17:39:49,"Apartamento en Arriendo, Loma De San Jose, Sabaneta",$40.000.000 | 367 m² | 3 | 4
2024-06-23 17:39:49,"Apartamento en Arriendo, Santa Paula, Bogotá D.C.",
2024-06-23 17:39:49,"Apartamento en Arriendo, Aves Maria, Sabaneta",$23.000.000 | 259 m² | 3 | 5
2024-06-23 17:39:49,"Apartamento en Arriendo, Cañaveralejo, Sabaneta",$23.000.000 | 259 m² | 3 | 5
2024-06-23 17:39:49,"Apartamento en Arriendo, El Retiro, Retiro",
2024-06-23 17:39:49,"Apartamento en Arriendo, Fontibon, Rionegro",$12.000.000 | 320 m² | 4 | 5
2024-06-23 17:39:49,"Apartamento en Arriendo, Suramerica, Itagui",$12.000.000 | 320 m² | 4 | 5
2024-06-23 17:39:49,"Apartamento en Arriendo, Loma De Las Brujas, Envigado",
2024-06-23 17:39:49,"Apartamento en Arriendo, El Retiro, Retiro",$2.650.000 | 77 m² | 3 | 2
