Fecha de Scraping,Título,Descripción
2024-06-23 18:33:36,"Apartamento en Venta, EL POBLADO, Medellín",$2.300.000.000 | 405 m² | 3 | 3
2024-06-23 18:33:36,"Apartamento en Venta, SOLARIUM DE PONTEVEDRA, Bogotá D.C.",$2.300.000.000 | 405 m² | 3 | 3
2024-06-23 18:33:36,"Apartamento en Venta, ALTOS DE MONTEARROYO, Bogotá D.C.",
2024-06-23 18:33:36,"Apartamento en Venta, CHICÓ NAVARRA, Bogotá D.C.",$1.600.000.000 | 400 m² | 4 | 4
2024-06-23 18:33:36,"Apartamento en Venta, LA FERRERIA, La Estrella",$1.600.000.000 | 400 m² | 4 | 4
2024-06-23 18:33:36,"Apartamento en Venta, CEDRO GOLF, Bogotá D.C.",
2024-06-23 18:33:36,"Apartamento en Venta, EL CONTADOR, Bogotá D.C.",$2.500.000.000 | 280 m² | 4 | 5
2024-06-23 18:33:36,"Apartamento en Venta, EL POBLADO EL TESORO, Medellín",$2.500.000.000 | 280 m² | 4 | 5
2024-06-23 18:33:36,"Apartamento en Venta, CHICO NORTE III, Bogotá D.C.",
2024-06-23 18:33:36,"Apartamento en Venta, VALLE DE LILI, Cali",$890.000.000 | 158 m² | 3 | 4
2024-06-23 18:33:36,"Apartamento en Venta, EL TRIANON, Envigado",$890.000.000 | 158 m² | 3 | 4
2024-06-23 18:33:36,"Apartamento en Venta, CEDRITOS, Bogotá D.C.",
2024-06-23 18:33:36,"Apartamento en Venta, loma de los benedictinos, Envigado",$1.728.000.000 | 299 m² | 5 | 4
2024-06-23 18:33:36,"Apartamento en Venta, CANDELARIA LA NUEVA, Bogotá D.C.",$1.728.000.000 | 299 m² | 5 | 4
2024-06-23 18:33:36,"Apartamento en Venta, ROSALES PIETRAMONTE, Bogotá D.C.",
2024-06-23 18:33:36,"Apartamento en Venta, Villa Campestre, Puerto Colombia",$510.000.000 | 99.17 m² | 4 | 3
2024-06-23 18:33:36,"Apartamento en Venta, CIUDAD JARDIN, Barranquilla",$510.000.000 | 99.17 m² | 4 | 3
2024-06-23 18:33:36,"Apartamento en Venta, PORTAL DE GENOVÉS, Barranquilla",
2024-06-23 18:33:36,"Apartamento en Venta, ALTOS DEL PRADO, Barranquilla",$450.000.000 | 220 m² | 3 | 4
2024-06-23 18:33:36,"Apartamento en Venta, ALTOS DEL MORAL, Bogotá D.C.",$450.000.000 | 220 m² | 3 | 4
2024-06-23 18:33:36,"Apartamento en Venta, RECODO DEL CONTRY, Bogotá D.C.",
2024-06-23 18:33:36,"Apartamento en Venta, VALLE DEL LILI, Cali",$320.000.000 | 145 m² | 3 | 3
2024-06-23 18:33:36,"Apartamento en Venta, LA CABRERA, Bogotá D.C.",$320.000.000 | 145 m² | 3 | 3
2024-06-23 18:33:36,"Apartamento en Venta, CHICO MUSEO, Bogotá D.C.",
2024-06-23 18:33:36,"Apartamento en Venta, URBANIZACION LA FLORA, Cali",$2.500.000.000 | 729 m² | 3 | 5
2024-06-23 18:33:36,"Apartamento en Venta, EL CHICO ALTO, Bogotá D.C.",$2.500.000.000 | 729 m² | 3 | 5
2024-06-23 18:33:36,"Apartamento en Venta, EL POBLADO, Medellín",
2024-06-23 18:33:36,"Apartamento en Venta, EL RECODO DEL COUNTRY, Bogotá D.C.",$425.000.000 | 225 m² | 5 | 4
2024-06-23 18:33:36,"Apartamento en Venta, EL POBLADO, Medellín",$425.000.000 | 225 m² | 5 | 4
2024-06-23 18:33:36,"Apartamento en Venta, FUNZA CR RECODO DE SAN ANDRES, Fu…",
2024-06-23 18:33:36,"Apartamento en Venta, LOS CEDRITOS, Bogotá D.C.",0
2024-06-23 18:33:36,"Apartamento en Venta, EL CHICO CHICO, Bogotá D.C.",0
2024-06-23 18:33:36,"Apartamento en Venta, SANTA BARBARA OCCIDENTAL SANTA …",126.63 | 4 | 4
2024-06-23 18:33:36,"Apartamento en Venta, SANTA BARBARA, Bogotá D.C.",$1.601.000.000 | 340 m² | 4 | 4
2024-06-23 18:33:36,"Apartamento en Venta, LA CAROLINA COUNTRY, Bogotá D.C.",$1.601.000.000 | 340 m² | 4 | 4
2024-06-23 18:33:36,"Casa en Venta, Las Americas, Manizales",
2024-06-23 18:33:36,"Casa en Venta, Otro, Manizales",$750.000.000 | 240 m² | 4 | 4
2024-06-23 18:33:36,"Apartamento en Venta, BRITALIA NORTE, Bogotá D.C.",$750.000.000 | 240 m² | 4 | 4
2024-06-23 18:33:36,"Apartamento en Venta, LOS ROSALES EMAUS, Bogotá D.C.",
2024-06-23 18:33:36,"Apartamento en Venta, EL POBLADO, Medellín",$1.500.000.000 | 400 m² | 4 | 3
2024-06-23 18:33:36,"Apartamento en Venta, LOMA DE LAS BRUJAS, Envigado",$1.500.000.000 | 400 m² | 4 | 3
2024-06-23 18:33:36,"Apartamento en Venta, ROALES, Bogotá D.C.",
2024-06-23 18:33:36,"Apartamento en Venta, SEÑORIAL, Envigado",$3.200.000.000 | 554 m² | 5 | 5
2024-06-23 18:33:36,"Apartamento en Venta, EL POBLADO, Medellín",$3.200.000.000 | 554 m² | 5 | 5
2024-06-23 18:33:36,"Apartamento en Venta, BELLA SUIZA BAJA, Bogotá D.C.",
2024-06-23 18:33:36,"Apartamento en Venta, SANTA BARBARA CENTRAL, Bogotá D.C.",$4.000.000.000 | 400 m² | 4 | 3
2024-06-23 18:33:36,"Apartamento en Venta, CUARTO DE LEGUA, Cali",$4.000.000.000 | 400 m² | 4 | 3
2024-06-23 18:33:36,"Apartamento en Venta, SANTA BARBARA OCCIDENTAL, Bogotá …",
2024-06-23 18:33:36,"Apartamento en Venta, CABRERA CHICO, Bogotá D.C.",$1.800.000.000 | 234 m² | 4 | 3
2024-06-23 18:33:36,"Apartamento en Venta, NUEVO SOTOMAYOR, Bucaramanga",$1.800.000.000 | 234 m² | 4 | 3
2024-06-23 18:33:36,"Apartamento en Venta, LAURELES, Medellín",
2024-06-23 18:33:36,"Apartamento en Venta, SANTA ANA, Bogotá D.C.",$1.980.000.000 | 320 m² | 4 | 4
2024-06-23 18:33:36,"Apartamento en Venta, LA CABRERA, Bogotá D.C.",$1.980.000.000 | 320 m² | 4 | 4
2024-06-23 18:33:36,"Apartamento en Venta, VALLE DEL LILI, Cali",
2024-06-23 18:33:36,"Apartamento en Venta, Cajicá",$2.000.000.000 | 480 m² | 4 | 4
2024-06-23 18:33:36,"Apartamento en Venta, BOCHALEMA, Cali",$2.000.000.000 | 480 m² | 4 | 4
2024-06-23 18:33:36,"Apartamento en Venta, ALTOS DEL PARQUE, Barranquilla",
2024-06-23 18:33:36,"Apartamento en Venta, FOREST  LA BALSA, Chía",$1.380.000.000 | 248 m² | 3 | 5
2024-06-23 18:33:36,"Apartamento en Venta, CASTILLO GRANDE, Cartagena de Indias",$1.380.000.000 | 248 m² | 3 | 5
2024-06-23 18:33:36,"Apartamento en Venta, LA CAROLINA, Bogotá D.C.",
2024-06-23 18:33:36,"Apartamento en Venta, SABANA DE TIBABUYES, Bogotá D.C.",$1.200.000.000 | 183 m² | 3 | 5
2024-06-23 18:33:36,"Apartamento en Venta, BOSQUE VERDE, Bogotá D.C.",$1.200.000.000 | 183 m² | 3 | 5
2024-06-23 18:33:36,"Apartamento en Venta, NUEVA CASTILLA, Bogotá D.C.",
2024-06-23 18:33:36,"Apartamento en Venta, LAS GRANJAS, Cali",$550.000.000 | 180 m² | 3 | 2
2024-06-23 18:33:36,"Apartamento en Venta, COLINA CAMPESTRE, Bogotá D.C.",$550.000.000 | 180 m² | 3 | 2
2024-06-23 18:33:36,"Apartamento en Venta, COLINA CAMPESTRE, Bogotá D.C.",
2024-06-23 18:33:36,"Apartamento en Venta, COLINA CAMPESTRE, Bogotá D.C.",$1.270.000.000 | 181 m² | 4 | 4
2024-06-23 18:33:36,"Apartamento en Venta, COLINA CAMPESTRE, Bogotá D.C.",$1.270.000.000 | 181 m² | 4 | 4
2024-06-23 18:33:36,"Apartamento en Venta, PRADO VERANIEGO, Bogotá D.C.",
2024-06-23 18:33:36,"Apartamento en Venta, Mazuren 21, Bogotá D.C.",$3.500.000.000 | 450 m² | 5 | 5
2024-06-23 18:33:36,"Apartamento en Venta, CIUDAD REAL, Cali",$3.500.000.000 | 450 m² | 5 | 5
2024-06-23 18:33:36,"Apartamento en Venta, CIUDAD SALITRE OCCIDENTAL, Bogotá …",
2024-06-23 18:33:36,"Apartamento en Venta, NORMADIA, Cali",$1.350.000.000 | 400 m² | 4 | 5
2024-06-23 18:33:36,"Apartamento en Venta, ENGATIVA, Bogotá D.C.",$1.350.000.000 | 400 m² | 4 | 5
2024-06-23 18:33:36,"Apartamento en Venta, ENGATIVA, Bogotá D.C.",
2024-06-23 18:33:36,"Apartamento en Venta, huertas de cajicá, Cajicá",$940.000.000 | 180 m² | 3 | 3
2024-06-23 18:33:36,"Apartamento en Venta, CHAPINERO QUINTA CAMACHO, Bogotá …",$940.000.000 | 180 m² | 3 | 3
2024-06-23 18:33:36,"Apartamento en Venta, villa campestre, Puerto Colombia",
2024-06-23 18:33:36,"Apartamento en Venta, LOS ROSALES EMAUS, Bogotá D.C.",$3.000.000.000 | 336 m² | 4 | 5
2024-06-23 18:33:36,"Apartamento en Venta, COLINA, Bogotá D.C.",$3.000.000.000 | 336 m² | 4 | 5
2024-06-23 18:33:36,"Apartamento en Venta, ALTOS DE SANTA ANA, Bogotá D.C.",
2024-06-23 18:33:36,"Apartamento en Venta, CHICO SAN PATRICIO, Bogotá D.C.",$480.000.000 | 95 m² | 4 | 3
2024-06-23 18:33:36,"Apartamento en Venta, SANTA BARBARA CENTRAL, Bogotá D.C.",$480.000.000 | 95 m² | 4 | 3
2024-06-23 18:33:36,"Apartamento en Venta, LA CAROLINA, Bogotá D.C.",
2024-06-23 18:33:36,"Apartamento en Venta, SUBA NARANJOS, Bogotá D.C.",$450.000.000 | 200 m² | 4 | 2
2024-06-23 18:33:36,"Apartamento en Venta, EL POBLADO PROVENZA, Medellín",$450.000.000 | 200 m² | 4 | 2
2024-06-23 18:33:36,"Apartamento en Venta, EL POBLADO LAS PALMAS, Medellín",
2024-06-23 18:33:36,"Apartamento en Venta, SANTA BARBARA CENTRAL USAQUEN, …",$900.000.000 | 505 m² | 5 | 5
2024-06-23 18:33:36,"Apartamento en Venta, EL POBLADO DE SANTA MARIA DE LOS …",$900.000.000 | 505 m² | 5 | 5
2024-06-23 18:33:36,"Apartamento en Venta, CABRERA, Bogotá D.C.",
2024-06-23 18:33:36,"Apartamento en Venta, CRISTALES, Cali",$850.000.000 | 164 m² | 3 | 4
2024-06-23 18:33:36,"Apartamento en Venta, Santa Barbara, Bogotá D.C.",$850.000.000 | 164 m² | 3 | 4
2024-06-23 18:33:36,"Apartamento en Venta, SANTA ISABEL, Cali",
2024-06-23 18:33:36,"Apartamento en Venta, CEDRITOS, Bogotá D.C.",$560.000.000 | 203 m² | 4 | 3
2024-06-23 18:33:36,"Apartamento en Venta, SIERRAS DEL MORAL, Bogotá D.C.",$560.000.000 | 203 m² | 4 | 3
2024-06-23 18:33:36,"Apartamento en Venta, ALTO DE RIOMAR, Barranquilla",
2024-06-23 18:33:36,"Apartamento en Venta, CENTRO, Cartagena de Indias",$3.100.000.000 | 400 m² | 3 | 4
2024-06-23 18:33:36,"Apartamento en Venta, SAN ANTONIO NORTE, Bogotá D.C.",$3.100.000.000 | 400 m² | 3 | 4
2024-06-23 18:33:36,"Apartamento en Venta, EL POBLADO DE SANTA MARIA DE LOS …",
2024-06-23 18:33:36,"Apartamento en Venta, EL POBLADO LA CALERA, Medellín",$670.000.000 | 200 m² | 3 | 4
2024-06-23 18:33:36,"Apartamento en Venta, Poblado  Campestre, Medellín",$670.000.000 | 200 m² | 3 | 4
2024-06-23 18:33:36,"Apartamento en Venta, JUANAMBU, Cali",
2024-06-23 18:33:36,"Apartamento en Venta, LOMA DE LAS BRUJAS  ENVIGADO, Mede…",$500.000.000 | 247 m² | 5 | 2
2024-06-23 18:33:36,"Apartamento en Venta, VILLA CAMPESTRE, Barranquilla",$500.000.000 | 247 m² | 5 | 2
2024-06-23 18:33:36,"Apartamento en Venta, ALTOS DEL REFUGIO, Bogotá D.C.",
2024-06-23 18:33:36,"Apartamento en Venta, SOTOMAYOR, Bucaramanga",$650.000.000 | 220 m² | 5 | 5
2024-06-23 18:33:36,"Apartamento en Venta, CABECERA DEL LLANO, Bucaramanga",$650.000.000 | 220 m² | 5 | 5
2024-06-23 18:33:36,"Apartamento en Venta, ALTOS DE SANTA TERESITA, Cali",
2024-06-23 18:33:36,"Apartamento en Venta, PLAYA SALGUERO, Santa Marta",$270.000.000 | 86 m² | 3 | 4
2024-06-23 18:33:36,"Apartamento en Venta, SANTA RITA, Cali",$270.000.000 | 86 m² | 3 | 4
2024-06-23 18:33:36,"Apartamento en Venta, CHICO SAN PATRICIO, Bogotá D.C.",
2024-06-23 18:33:36,"Apartamento en Venta, CEDRITOS, Bogotá D.C.",$3.100.000.000 | 550 m² | 4 | 5
